{
  "version": "1",
  "provenance": {
    "mermaid_version": "bundled-in-mermaidx-0.9.4",
    "renderer": "mermaidx",
    "renderer_version": "0.9.4",
    "source_sha256": "48e5149fc348837aa5d246d963f63f468ae3c60f8012993f4802fa072262843b",
    "generated_at": "FIXED"
  },
  "canvas": {
    "width": 94.9609375,
    "height": 279.1875,
    "origin_offset": {
      "x": 8.0,
      "y": 8.0
    },
    "direction": "TB"
  },
  "nodes": [
    {
      "id": "z",
      "svg_id": "gd10-flowchart-z-3",
      "label": "Z",
      "shape": "rect",
      "x": 0.0,
      "y": 197.25,
      "width": 70.9609375,
      "height": 48.625,
      "parent": null
    },
    {
      "id": "y",
      "svg_id": "gd10-flowchart-y-1",
      "label": "Y",
      "shape": "rect",
      "x": 0.59375,
      "y": 98.625,
      "width": 69.7734375,
      "height": 48.625,
      "parent": null
    },
    {
      "id": "x",
      "svg_id": "gd10-flowchart-x-0",
      "label": "X",
      "shape": "rect",
      "x": 0.0,
      "y": 0.0,
      "width": 70.9609375,
      "height": 48.625,
      "parent": null
    }
  ],
  "clusters": [],
  "edges": [
    {
      "id": "L_y_z_0",
      "source": "y",
      "target": "z",
      "label": null,
      "label_pos": null,
      "points": [
        [
          35.48,
          147.25
        ],
        [
          35.48,
          193.25
        ]
      ],
      "start_point": [
        35.48,
        147.25
      ],
      "end_point": [
        35.48,
        193.25
      ],
      "handle_point": null
    },
    {
      "id": "L_x_y_0",
      "source": "x",
      "target": "y",
      "label": null,
      "label_pos": null,
      "points": [
        [
          35.48,
          48.625
        ],
        [
          35.48,
          94.625
        ]
      ],
      "start_point": [
        35.48,
        48.625
      ],
      "end_point": [
        35.48,
        94.625
      ],
      "handle_point": null
    }
  ],
  "warnings": []
}