{
  "version": "1",
  "provenance": {
    "mermaid_version": "bundled-in-mermaidx-0.9.4",
    "renderer": "mermaidx",
    "renderer_version": "0.9.4",
    "source_sha256": "49212c5f3186320d54a890af837459c9d053a122a041a0ffda6a21d1777e5bb5",
    "generated_at": "FIXED"
  },
  "canvas": {
    "width": 328.99375000000003,
    "height": 208.875,
    "origin_offset": {
      "x": 8.0,
      "y": 20.918750000000003
    },
    "direction": "LR"
  },
  "nodes": [
    {
      "id": "c",
      "svg_id": "gd12-flowchart-c-6",
      "label": "C",
      "shape": "rect",
      "x": 0.0,
      "y": 114.01875,
      "width": 71.171875,
      "height": 48.625,
      "parent": null
    },
    {
      "id": "b",
      "svg_id": "gd12-flowchart-b-1",
      "label": "B",
      "shape": "rect",
      "x": 183.8671875,
      "y": 5.393749999999997,
      "width": 70.9765625,
      "height": 48.625,
      "parent": null
    },
    {
      "id": "a",
      "svg_id": "gd12-flowchart-a-0",
      "label": "A",
      "shape": "rect",
      "x": 0.11328125,
      "y": 0.0,
      "width": 70.9453125,
      "height": 48.625,
      "parent": null
    }
  ],
  "clusters": [],
  "edges": [
    {
      "id": "L_c_c_0",
      "source": "c",
      "target": "c",
      "label": null,
      "label_pos": {
        "x": 304.89375,
        "y": 138.33125
      },
      "points": [
        [
          71.172,
          127.58125
        ],
        [
          81.6766296296296,
          124.842005787037
        ],
        [
          87.547,
          125.16584375000001
        ],
        [
          91.172,
          127.53925
        ],
        [
          93.86229629629632,
          134.20710185185186
        ],
        [
          93.69115624999999,
          144.48400000000004
        ],
        [
          90.90336921296297,
          150.41998090277775
        ],
        [
          85.0865,
          152.534625
        ],
        [
          75.001,
          150.23825
        ]
      ],
      "start_point": [
        71.172,
        127.58125
      ],
      "end_point": [
        75.001,
        150.23825
      ],
      "handle_point": [
        93.86229629629632,
        134.20710185185186
      ]
    },
    {
      "id": "L_b_a_0",
      "source": "b",
      "target": "a",
      "label": null,
      "label_pos": {
        "x": 219.35546875,
        "y": 108.675
      },
      "points": [
        [
          183.867,
          44.07424999999999
        ],
        [
          152.69449157942648,
          55.50174795175239
        ],
        [
          128.106,
          59.00725
        ],
        [
          104.09313973600365,
          54.76596005917159
        ],
        [
          74.688,
          42.42125
        ]
      ],
      "start_point": [
        183.867,
        44.07424999999999
      ],
      "end_point": [
        74.688,
        42.42125
      ],
      "handle_point": [
        128.106,
        59.00725
      ]
    },
    {
      "id": "L_a_b_2",
      "source": "a",
      "target": "b",
      "label": null,
      "label_pos": null,
      "points": [
        [
          71.059,
          26.393249999999995
        ],
        [
          126.834,
          29.154249999999998
        ],
        [
          179.867,
          29.706249999999997
        ]
      ],
      "start_point": [
        71.059,
        26.393249999999995
      ],
      "end_point": [
        179.867,
        29.706249999999997
      ],
      "handle_point": [
        126.46879170522664,
        41.14869133344395
      ]
    },
    {
      "id": "L_a_b_0",
      "source": "a",
      "target": "b",
      "label": null,
      "label_pos": null,
      "points": [
        [
          71.059,
          14.311249999999994
        ],
        [
          102.63377535687454,
          6.294831517655901
        ],
        [
          126.87,
          4.033249999999999
        ],
        [
          150.48316679188576,
          7.174373215627341
        ],
        [
          180.081,
          16.31525
        ]
      ],
      "start_point": [
        71.059,
        14.311249999999994
      ],
      "end_point": [
        180.081,
        16.31525
      ],
      "handle_point": [
        126.42891584603936,
        28.029196423700917
      ]
    }
  ],
  "warnings": [
    {
      "code": "parallel_edge_offset",
      "detail": "offset handle of parallel edge 'L_a_b_2' by 12px"
    },
    {
      "code": "parallel_edge_offset",
      "detail": "offset handle of parallel edge 'L_a_b_0' by 24px"
    }
  ]
}